{
  "run_id": "r-2026-08-01-si1",
  "v1_sha256": "ee44802815a7",
  "generated_at": "2026-08-01T00:00:00Z",
  "findings": [
    {
      "id": "F-201",
      "arm": "claim",
      "kind": "contradiction",
      "action": "auto_applied",
      "status": "applied",
      "route": "auto_correct",
      "section_ref": "\u00a72",
      "claim_provenance": "source",
      "verdict": "contradicted",
      "evidence": [
        {
          "path": "src/routing/brand_router.c",
          "symbol": "route_transaction",
          "lines": [
            24,
            47
          ]
        },
        {
          "path": "include/txn.h",
          "lines": [
            37,
            37
          ]
        }
      ],
      "reasoning": "v1 \u00a72 states brand identification is a PAN BIN-range lookup at authorization, sourced from the routing KB. The code has no PAN or BIN-range lookup anywhere: txn_t carries pan_token[24] ('tokenized PAN, never the real number') and route_transaction() receives t->brand ALREADY RESOLVED, calling get_brand_rule(t->brand). The KB describes a mechanism this repo does not implement.",
      "section_target": "\u00a72"
    },
    {
      "id": "F-202",
      "arm": "claim",
      "kind": "confirmation",
      "action": "none",
      "status": "applied",
      "route": "none",
      "section_ref": "\u00a72",
      "verdict": "confirmed",
      "evidence": [
        {
          "path": "src/routing/route_table.c"
        },
        {
          "path": "src/routing/brand_registry.c"
        }
      ],
      "reasoning": "Routing is table-driven and dispatches to per-brand handlers via register_brand_routes()/lookup_handler() \u2014 confirmed."
    },
    {
      "id": "F-203",
      "arm": "claim",
      "kind": "unverifiable",
      "action": "auto_applied",
      "status": "applied",
      "route": "auto_write",
      "section_ref": "\u00a710",
      "verdict": "unverifiable",
      "reasoning": "\u00a710 states field-level mappings are registry-held. field_codec.c exists but the 'format registry' the KB names is not identifiable in this repo \u2014 likely external.",
      "section_target": "\u00a714"
    },
    {
      "id": "F-204",
      "arm": "claim",
      "kind": "unverifiable",
      "action": "auto_applied",
      "status": "applied",
      "route": "auto_write",
      "section_ref": "\u00a72",
      "claim_provenance": "operator",
      "verdict": "unverifiable",
      "reasoning": "\u00a72's volumes, wallet share and interchange-leakage figures are operator-supplied. No codebase can confirm a business volume; Arm 2 stops rather than guessing.",
      "section_target": "\u00a714"
    },
    {
      "id": "F-301",
      "arm": "impact",
      "kind": "gap_fill",
      "action": "auto_applied",
      "status": "applied",
      "route": "auto_fill",
      "requirement_ref": "R2",
      "assertion_ref": "R2.1",
      "section_ref": "\u00a713",
      "verdict": "answered",
      "evidence": [
        {
          "path": "include/message.h",
          "symbol": "iso_msg_t",
          "lines": [
            22,
            26
          ]
        },
        {
          "path": "src/messaging/iso8583.c",
          "symbol": "build_iso8583",
          "lines": [
            28,
            48
          ]
        }
      ],
      "reasoning": "\u00a713 A4 asked which DE 48 subelements the parser builds today. Answer: NONE, and it has no concept of them. iso_msg_t models the message as a flat char *fields[128] indexed by field number, so DE 48 is one opaque string with no subelement structure. All four mandated subelements require a sub-TLV layer that does not exist.",
      "section_target": "\u00a713"
    },
    {
      "id": "F-310",
      "arm": "impact",
      "kind": "derived_impact",
      "action": "auto_applied",
      "status": "applied",
      "route": "auto_write",
      "requirement_ref": "R1",
      "assertion_ref": "R1.2",
      "verdict": "impacted",
      "evidence": [
        {
          "path": "src/messaging/field_codec.c"
        }
      ],
      "reasoning": "DE 48.66 TRID must survive encode/decode; the per-field codec enforces preservation",
      "business_visible": false,
      "section_target": "\u00a716"
    },
    {
      "id": "F-311",
      "arm": "impact",
      "kind": "derived_impact",
      "action": "auto_applied",
      "status": "applied",
      "route": "auto_write",
      "requirement_ref": "R2",
      "assertion_ref": "R2.2",
      "verdict": "impacted",
      "evidence": [
        {
          "path": "src/messaging/field_codec.c"
        }
      ],
      "reasoning": "DE 48.77 wallet indicator needs an encode path in the per-field codec",
      "business_visible": false,
      "section_target": "\u00a716"
    },
    {
      "id": "F-312",
      "arm": "impact",
      "kind": "derived_impact",
      "action": "auto_applied",
      "status": "applied",
      "route": "auto_write",
      "requirement_ref": "R2",
      "assertion_ref": "R2.3",
      "verdict": "impacted",
      "evidence": [
        {
          "path": "src/messaging/field_codec.c"
        }
      ],
      "reasoning": "DE 48.78 token assurance needs encode/decode plus the <10 RC 55 trigger",
      "business_visible": false,
      "section_target": "\u00a716"
    },
    {
      "id": "F-313",
      "arm": "impact",
      "kind": "derived_impact",
      "action": "auto_applied",
      "status": "applied",
      "route": "auto_write",
      "requirement_ref": "R5",
      "assertion_ref": "R5.1",
      "verdict": "impacted",
      "evidence": [
        {
          "path": "src/routing/error_codes.c"
        }
      ],
      "reasoning": "RC 55 re-mapping lands on the error code table and its text",
      "business_visible": false,
      "section_target": "\u00a716"
    },
    {
      "id": "F-314",
      "arm": "impact",
      "kind": "derived_impact",
      "action": "auto_applied",
      "status": "applied",
      "route": "auto_write",
      "requirement_ref": "R5",
      "assertion_ref": "R5.2",
      "verdict": "impacted",
      "evidence": [
        {
          "path": "src/routing/fallback.c"
        }
      ],
      "reasoning": "merchant-facing decline text on the fallback path",
      "business_visible": false,
      "section_target": "\u00a716"
    },
    {
      "id": "F-315",
      "arm": "impact",
      "kind": "derived_impact",
      "action": "auto_applied",
      "status": "applied",
      "route": "auto_write",
      "requirement_ref": "R4",
      "assertion_ref": "R4.1",
      "verdict": "impacted",
      "evidence": [
        {
          "path": "src/routing/retry.c"
        }
      ],
      "reasoning": "the 4000ms bound and secondary-endpoint attempt land on bounded retry",
      "business_visible": false,
      "section_target": "\u00a716"
    },
    {
      "id": "F-316",
      "arm": "impact",
      "kind": "derived_impact",
      "action": "auto_applied",
      "status": "applied",
      "route": "auto_write",
      "requirement_ref": "R4",
      "assertion_ref": "R4.3",
      "verdict": "impacted",
      "evidence": [
        {
          "path": "src/routing/dispatch.c"
        }
      ],
      "reasoning": "STIP forwarding on secondary timeout is a dispatch decision",
      "business_visible": false,
      "section_target": "\u00a716"
    },
    {
      "id": "F-317",
      "arm": "impact",
      "kind": "derived_impact",
      "action": "auto_applied",
      "status": "applied",
      "route": "auto_write",
      "requirement_ref": "R7",
      "assertion_ref": "R7.1",
      "verdict": "impacted",
      "evidence": [
        {
          "path": "src/routing/route_table.c"
        }
      ],
      "reasoning": "Banknet endpoint selection is table-driven here",
      "business_visible": false,
      "section_target": "\u00a716"
    },
    {
      "id": "F-318",
      "arm": "impact",
      "kind": "derived_impact",
      "action": "auto_applied",
      "status": "applied",
      "route": "auto_write",
      "requirement_ref": "R7",
      "assertion_ref": "R7.3",
      "verdict": "impacted",
      "evidence": [
        {
          "path": "src/routing/brand_registry.c"
        }
      ],
      "reasoning": "token BIN routing binds through the handler registry",
      "business_visible": false,
      "section_target": "\u00a716"
    },
    {
      "id": "F-319",
      "arm": "impact",
      "kind": "derived_impact",
      "action": "auto_applied",
      "status": "applied",
      "route": "auto_write",
      "requirement_ref": "R8",
      "assertion_ref": "R8.1",
      "verdict": "impacted",
      "evidence": [
        {
          "path": "src/messaging/formatter.c"
        }
      ],
      "reasoning": "DSR format changes land on settlement message formatting",
      "business_visible": false,
      "section_target": "\u00a716"
    },
    {
      "id": "F-320",
      "arm": "impact",
      "kind": "contradiction",
      "action": "escalated",
      "status": "dispositioned",
      "route": "escalate",
      "requirement_ref": "R2",
      "assertion_ref": "R2.1",
      "section_ref": "\u00a713",
      "claim_provenance": "operator",
      "verdict": "contradicted",
      "evidence": [
        {
          "path": "src/messaging/iso8583.c",
          "symbol": "build_iso8583",
          "lines": [
            28,
            48
          ]
        },
        {
          "path": "src/messaging/iso8583_v2.c",
          "symbol": "build_iso8583_v2",
          "lines": [
            38,
            60
          ]
        }
      ],